{
  "schema_version": "adaptive_creator_loop.swarm_contribution_packet.v1",
  "packet_id": "swarm-packet-2026-05-01-startup-yc",
  "creator_run_id": "creator-run-2026-05-01-startup-yc",
  "source": {
    "repo": "specialization-path-startup-yc",
    "branch": "master",
    "commit": "97b89c8",
    "artifact_paths": [
      "reports/absorption-proof-2026-04-30/proof_report.json",
      "reports/absorption-proof-2026-04-30/proof_report.md",
      "reports/absorption-proof-2026-04-30/weak_case_diagnosis.md",
      "docs/STARTUP_YC_FRESH_VALIDATION_SUITE_2026-05-01.md",
      "reports/startup-yc-fresh-validation-suite-v2/adapter_selector_report.json"
    ]
  },
  "contribution": {
    "type": "mastery",
    "title": "Startup YC transfer-supported fresh validation packet",
    "summary": "Fresh-agent validated-pack mode improved the 20-case Startup YC absorption suite by +0.0200 mean score, and current Startup YC adapters won 12/12 fresh-validation Startup Bench scenarios across six tracks with mean scenario delta +0.0560.",
    "domain": "Startup YC",
    "intended_consumers": [
      "Spark agents entering the Startup YC specialization path",
      "Builder agents creating new specialization paths",
      "Autoloop agents evaluating mastery packet promotion"
    ]
  },
  "evidence": {
    "tier": "transfer_supported",
    "baseline_score": 0.6803,
    "candidate_score": 0.7003,
    "mean_delta": 0.02,
    "trap_regressions": 0,
    "fresh_agent_absorption_delta": 0.02,
    "simulator_or_arena_result": {
      "source": "startup-bench",
      "suite": "startup_yc_fresh_validation_suite",
      "scenario_count": 12,
      "baseline_runner": "heuristic_resilient_operator",
      "transfer_runner": "specialization-path-startup-yc adapter selector",
      "baseline_score": 0.7139,
      "transfer_score": 0.7699,
      "delta": 0.056,
      "min_delta": 0.0144,
      "max_delta": 0.141,
      "constraints_passed": true
    },
    "report_paths": [
      "reports/baseline.json",
      "reports/candidate.json",
      "reports/absorption_summary.json",
      "reports/evidence_ladder.md",
      "reports/transfer_summary.json",
      "reports/broad_transfer_probe.json"
    ]
  },
  "governance": {
    "review_state": "workspace_fixture",
    "reviewers": [
      "codex"
    ],
    "rollback_or_deprecation_rule": "Deprecate if full-suite absorption repeat loses positive validated-pack mean delta, fresh validation min delta turns negative, or trap regression appears.",
    "privacy_boundary": "workspace_only",
    "network_publication_allowed": false
  },
  "anti_drift": {
    "lineage_summary": "Startup YC weak cases were diagnosed and focused patches were repeated before this fixture was created.",
    "ghost_improvement_check": "The source report compares no-pack, pack, and validated-pack fresh-agent modes with numeric deltas rather than only style changes.",
    "complexity_delta": "Fixture adds no runtime complexity; it packages existing evidence into the adaptive creator-run artifact contract.",
    "known_limits": [
      "Fresh validation currently ran seed 0 only.",
      "Human/operator review and calibration are still needed before network-absorbable claims.",
      "Network publication remains disabled in this fixture.",
      "Normal smoke validates saved evidence semantics. Recompute mode exists for supported provenance-tagged generated runs, but this curated fixture does not yet rerun external Startup Bench or specialization-path source reports."
    ]
  }
}
